{
  "baseline_validation": {
    "cosim": "FAIL",
    "csim": "PASS",
    "synth": "PASS"
  },
  "evidence_level": "DETERMINISTIC_FIXTURE_NOT_REAL_VITIS",
  "expected_failing_gate": "cosim",
  "expected_mode": "STRUCTURAL_FIX",
  "golden_kernel_sha256": "73e3fa7134a9d9ca79892e9fe606f32da837cfa7cb89d5cbe1ff00ac09243450",
  "golden_validation": {
    "cosim": "PASS",
    "csim": "PASS",
    "synth": "PASS"
  },
  "mutated_kernel_sha256": "6f2db94db472c9ec24b6af69045d3b3be13def04967976285d9533de1c50702f",
  "planner_input_policy": {
    "allowed_paths": [
      "task.toml",
      "description.md",
      "kernel.cpp",
      "kernel.h",
      "kernel_tb.cpp"
    ],
    "forbidden_components": [
      "answer",
      "golden",
      "hidden",
      "hidden_like",
      "reference"
    ]
  },
  "requires_cosim": true,
  "schema_version": "v3d.acceptance.v1",
  "task_id": "v3d_fast_018"
}
