{
  "baseline_validation": {
    "cosim": "NOT_RUN",
    "csim": "PASS",
    "synth": "PASS"
  },
  "evidence_level": "DETERMINISTIC_FIXTURE_NOT_REAL_VITIS",
  "expected_failing_gate": "ppa",
  "expected_mode": "OPTIMIZE",
  "golden_kernel_sha256": "d43510556ebc7e977c60dabd58b45a0afac8da591d1674ff56e78d4ba510707a",
  "golden_validation": {
    "cosim": "PASS",
    "csim": "PASS",
    "synth": "PASS"
  },
  "mutated_kernel_sha256": "2a1d82f6f12f0b41e69ef2293bbaa12a76ad809f7d7709b0c425026faed544c8",
  "planner_input_policy": {
    "allowed_paths": [
      "task.toml",
      "description.md",
      "kernel.cpp",
      "kernel.h",
      "kernel_tb.cpp"
    ],
    "forbidden_components": [
      "answer",
      "golden",
      "hidden",
      "hidden_like",
      "reference"
    ]
  },
  "requires_cosim": false,
  "schema_version": "v3d.acceptance.v1",
  "task_id": "v3d_fast_026"
}
