{
  "baseline_validation": {
    "cosim": "NOT_RUN",
    "csim": "FAIL",
    "synth": "NOT_RUN"
  },
  "evidence_level": "DETERMINISTIC_FIXTURE_NOT_REAL_VITIS",
  "expected_failing_gate": "csim",
  "expected_mode": "REPAIR",
  "golden_kernel_sha256": "a15d99eaa773220073945e8119755f5647ad4fcf9ba86d219eaa0fb7bf9c8d10",
  "golden_validation": {
    "cosim": "PASS",
    "csim": "PASS",
    "synth": "PASS"
  },
  "mutated_kernel_sha256": "df8e9d495ef20e9bbc1923d602f6e9b953436beff7653a5f6d6ace1062137c18",
  "planner_input_policy": {
    "allowed_paths": [
      "task.toml",
      "description.md",
      "kernel.cpp",
      "kernel.h",
      "kernel_tb.cpp"
    ],
    "forbidden_components": [
      "answer",
      "golden",
      "hidden",
      "hidden_like",
      "reference"
    ]
  },
  "requires_cosim": false,
  "schema_version": "v3d.acceptance.v1",
  "task_id": "v3d_fast_005"
}
