{
  "baseline_validation": {
    "cosim": "NOT_RUN",
    "csim": "FAIL",
    "synth": "NOT_RUN"
  },
  "evidence_level": "DETERMINISTIC_FIXTURE_NOT_REAL_VITIS",
  "expected_failing_gate": "csim",
  "expected_mode": "REPAIR",
  "golden_kernel_sha256": "5372e6e44b5f2cba348143f0958cddedd455d28a6ac02f8695dab2cef55a52ef",
  "golden_validation": {
    "cosim": "PASS",
    "csim": "PASS",
    "synth": "PASS"
  },
  "mutated_kernel_sha256": "96bdd5ad84682bf07251b6f53130bfb77a81cca351e64d075c3c3e6d7377bb46",
  "planner_input_policy": {
    "allowed_paths": [
      "task.toml",
      "description.md",
      "kernel.cpp",
      "kernel.h",
      "kernel_tb.cpp"
    ],
    "forbidden_components": [
      "answer",
      "golden",
      "hidden",
      "hidden_like",
      "reference"
    ]
  },
  "requires_cosim": false,
  "schema_version": "v3d.acceptance.v1",
  "task_id": "v3d_fast_004"
}
