{
  "baseline_validation": {
    "cosim": "NOT_RUN",
    "csim": "PASS",
    "synth": "FAIL"
  },
  "evidence_level": "DETERMINISTIC_FIXTURE_NOT_REAL_VITIS",
  "expected_failing_gate": "synth",
  "expected_mode": "SYNTH_FIX",
  "golden_kernel_sha256": "a4abf858b293ae30284592b740e99d65e38da949b9c9b9b589f36be66d4bd7ad",
  "golden_validation": {
    "cosim": "PASS",
    "csim": "PASS",
    "synth": "PASS"
  },
  "mutated_kernel_sha256": "18c38ba2133b05f64dce17bf18b29a8b781685a2c3afa41ee7f2f323911f844f",
  "planner_input_policy": {
    "allowed_paths": [
      "task.toml",
      "description.md",
      "kernel.cpp",
      "kernel.h",
      "kernel_tb.cpp"
    ],
    "forbidden_components": [
      "answer",
      "golden",
      "hidden",
      "hidden_like",
      "reference"
    ]
  },
  "requires_cosim": false,
  "schema_version": "v3d.acceptance.v1",
  "task_id": "v3d_fast_014"
}
